No.     Time           Source                Destination           Protocol Length Info
      1 0.000000       2a01:cb14:d31:4a00:12b:873b:196e:e52b 2a01:cb14:d31:4a00:7ec1:77ff:fe4b:17a0 ICMPv6   86     Neighbor Solicitation for 2a01:cb14:d31:4a00:7ec1:77ff:fe4b:17a0 from 08:d2:3e:e9:06:7e

Frame 1: 86 bytes on wire (688 bits), 86 bytes captured (688 bits)
    Encapsulation type: Ethernet (1)
    Arrival Time: Aug 14, 2023 11:43:03.000000000 Paris, Madrid (heure d’été)
    UTC Arrival Time: Aug 14, 2023 09:43:03.000000000 UTC
    Epoch Arrival Time: 1692006183.000000000
    [Time shift for this packet: 0.000000000 seconds]
    [Time delta from previous captured frame: 0.000000000 seconds]
    [Time delta from previous displayed frame: 0.000000000 seconds]
    [Time since reference or first frame: 0.000000000 seconds]
    Frame Number: 1
    Frame Length: 86 bytes (688 bits)
    Capture Length: 86 bytes (688 bits)
    [Frame is marked: False]
    [Frame is ignored: False]
    [Protocols in frame: eth:ethertype:ipv6:icmpv6]
    [Coloring Rule Name: ICMP]
    [Coloring Rule String: icmp || icmpv6]
Ethernet II, Src: Intel_e9:06:7e (08:d2:3e:e9:06:7e), Dst: IngramMicroS_4b:17:a0 (7c:c1:77:4b:17:a0)
    Destination: IngramMicroS_4b:17:a0 (7c:c1:77:4b:17:a0)
        .... ..0. .... .... .... .... = LG bit: Globally unique address (factory default)
        .... ...0 .... .... .... .... = IG bit: Individual address (unicast)
    Source: Intel_e9:06:7e (08:d2:3e:e9:06:7e)
        .... ..0. .... .... .... .... = LG bit: Globally unique address (factory default)
        .... ...0 .... .... .... .... = IG bit: Individual address (unicast)
    Type: IPv6 (0x86dd)
    [Stream index: 0]
Internet Protocol Version 6, Src: 2a01:cb14:d31:4a00:12b:873b:196e:e52b, Dst: 2a01:cb14:d31:4a00:7ec1:77ff:fe4b:17a0
    0110 .... = Version: 6
    .... 0000 0000 .... .... .... .... .... = Traffic Class: 0x00 (DSCP: CS0, ECN: Not-ECT)
        .... 0000 00.. .... .... .... .... .... = Differentiated Services Codepoint: Default (0)
        .... .... ..00 .... .... .... .... .... = Explicit Congestion Notification: Not ECN-Capable Transport (0)
    .... 0000 0000 0000 0000 0000 = Flow Label: 0x00000
    Payload Length: 32
    Next Header: ICMPv6 (58)
    Hop Limit: 255
    Source Address: 2a01:cb14:d31:4a00:12b:873b:196e:e52b
        [Address Space: Global Unicast]
    Destination Address: 2a01:cb14:d31:4a00:7ec1:77ff:fe4b:17a0
        [Address Space: Global Unicast]
    [Destination SLAAC MAC: IngramMicroS_4b:17:a0 (7c:c1:77:4b:17:a0)]
    [Stream index: 0]
Internet Control Message Protocol v6
    Type: Neighbor Solicitation (135)
    Code: 0
    Checksum: 0xa43a [correct]
    [Checksum Status: Good]
    Reserved: 00000000
    Target Address: 2a01:cb14:d31:4a00:7ec1:77ff:fe4b:17a0
    ICMPv6 Option (Source link-layer address : 08:d2:3e:e9:06:7e)
        Type: Source link-layer address (1)
        Length: 1 (8 bytes)
        Link-layer address: Intel_e9:06:7e (08:d2:3e:e9:06:7e)

0000  7c c1 77 4b 17 a0 08 d2 3e e9 06 7e 86 dd 60 00   |.wK....>..~..`.
0010  00 00 00 20 3a ff 2a 01 cb 14 0d 31 4a 00 01 2b   ... :.*....1J..+
0020  87 3b 19 6e e5 2b 2a 01 cb 14 0d 31 4a 00 7e c1   .;.n.+*....1J.~.
0030  77 ff fe 4b 17 a0 87 00 a4 3a 00 00 00 00 2a 01   w..K.....:....*.
0040  cb 14 0d 31 4a 00 7e c1 77 ff fe 4b 17 a0 01 01   ...1J.~.w..K....
0050  08 d2 3e e9 06 7e                                 ..>..~

No.     Time           Source                Destination           Protocol Length Info
      2 0.000000       2a01:cb14:d31:4a00:7ec1:77ff:fe4b:17a0 2a01:cb14:d31:4a00:12b:873b:196e:e52b ICMPv6   78     Neighbor Advertisement 2a01:cb14:d31:4a00:7ec1:77ff:fe4b:17a0 (rtr, sol)

Frame 2: 78 bytes on wire (624 bits), 78 bytes captured (624 bits)
    Encapsulation type: Ethernet (1)
    Arrival Time: Aug 14, 2023 11:43:03.000000000 Paris, Madrid (heure d’été)
    UTC Arrival Time: Aug 14, 2023 09:43:03.000000000 UTC
    Epoch Arrival Time: 1692006183.000000000
    [Time shift for this packet: 0.000000000 seconds]
    [Time delta from previous captured frame: 0.000000000 seconds]
    [Time delta from previous displayed frame: 0.000000000 seconds]
    [Time since reference or first frame: 0.000000000 seconds]
    Frame Number: 2
    Frame Length: 78 bytes (624 bits)
    Capture Length: 78 bytes (624 bits)
    [Frame is marked: False]
    [Frame is ignored: False]
    [Protocols in frame: eth:ethertype:ipv6:icmpv6]
    [Coloring Rule Name: ICMP]
    [Coloring Rule String: icmp || icmpv6]
Ethernet II, Src: IngramMicroS_4b:17:a0 (7c:c1:77:4b:17:a0), Dst: Intel_e9:06:7e (08:d2:3e:e9:06:7e)
    Destination: Intel_e9:06:7e (08:d2:3e:e9:06:7e)
        .... ..0. .... .... .... .... = LG bit: Globally unique address (factory default)
        .... ...0 .... .... .... .... = IG bit: Individual address (unicast)
    Source: IngramMicroS_4b:17:a0 (7c:c1:77:4b:17:a0)
        .... ..0. .... .... .... .... = LG bit: Globally unique address (factory default)
        .... ...0 .... .... .... .... = IG bit: Individual address (unicast)
    Type: IPv6 (0x86dd)
    [Stream index: 0]
Internet Protocol Version 6, Src: 2a01:cb14:d31:4a00:7ec1:77ff:fe4b:17a0, Dst: 2a01:cb14:d31:4a00:12b:873b:196e:e52b
    0110 .... = Version: 6
    .... 1100 0000 .... .... .... .... .... = Traffic Class: 0xc0 (DSCP: CS6, ECN: Not-ECT)
        .... 1100 00.. .... .... .... .... .... = Differentiated Services Codepoint: Class Selector 6 (48)
        .... .... ..00 .... .... .... .... .... = Explicit Congestion Notification: Not ECN-Capable Transport (0)
    .... 0000 0000 0000 0000 0000 = Flow Label: 0x00000
    Payload Length: 24
    Next Header: ICMPv6 (58)
    Hop Limit: 255
    Source Address: 2a01:cb14:d31:4a00:7ec1:77ff:fe4b:17a0
        [Address Space: Global Unicast]
    Destination Address: 2a01:cb14:d31:4a00:12b:873b:196e:e52b
        [Address Space: Global Unicast]
    [Source SLAAC MAC: IngramMicroS_4b:17:a0 (7c:c1:77:4b:17:a0)]
    [Stream index: 0]
Internet Control Message Protocol v6
    Type: Neighbor Advertisement (136)
    Code: 0
    Checksum: 0x327c [correct]
    [Checksum Status: Good]
    Flags: 0xc0000000, Router, Solicited
        1... .... .... .... .... .... .... .... = Router: Set
        .1.. .... .... .... .... .... .... .... = Solicited: Set
        ..0. .... .... .... .... .... .... .... = Override: Not set
        ...0 0000 0000 0000 0000 0000 0000 0000 = Reserved: 0
    Target Address: 2a01:cb14:d31:4a00:7ec1:77ff:fe4b:17a0

0000  08 d2 3e e9 06 7e 7c c1 77 4b 17 a0 86 dd 6c 00   ..>..~|.wK....l.
0010  00 00 00 18 3a ff 2a 01 cb 14 0d 31 4a 00 7e c1   ....:.*....1J.~.
0020  77 ff fe 4b 17 a0 2a 01 cb 14 0d 31 4a 00 01 2b   w..K..*....1J..+
0030  87 3b 19 6e e5 2b 88 00 32 7c c0 00 00 00 2a 01   .;.n.+..2|....*.
0040  cb 14 0d 31 4a 00 7e c1 77 ff fe 4b 17 a0         ...1J.~.w..K..

No.     Time           Source                Destination           Protocol Length Info
      3 0.000000       192.168.1.1           224.0.0.1             IGMPv2   60     Membership Query, general

Frame 3: 60 bytes on wire (480 bits), 60 bytes captured (480 bits)
    Encapsulation type: Ethernet (1)
    Arrival Time: Aug 14, 2023 11:43:03.000000000 Paris, Madrid (heure d’été)
    UTC Arrival Time: Aug 14, 2023 09:43:03.000000000 UTC
    Epoch Arrival Time: 1692006183.000000000
    [Time shift for this packet: 0.000000000 seconds]
    [Time delta from previous captured frame: 0.000000000 seconds]
    [Time delta from previous displayed frame: 0.000000000 seconds]
    [Time since reference or first frame: 0.000000000 seconds]
    Frame Number: 3
    Frame Length: 60 bytes (480 bits)
    Capture Length: 60 bytes (480 bits)
    [Frame is marked: False]
    [Frame is ignored: False]
    [Protocols in frame: eth:ethertype:ip:igmp:igmp]
    [Coloring Rule Name: Routing]
    [Coloring Rule String: hsrp || eigrp || ospf || bgp || cdp || vrrp || carp || gvrp || igmp || ismp]
Ethernet II, Src: IngramMicroS_4b:17:a0 (7c:c1:77:4b:17:a0), Dst: IPv4mcast_01 (01:00:5e:00:00:01)
    Destination: IPv4mcast_01 (01:00:5e:00:00:01)
        .... ..0. .... .... .... .... = LG bit: Globally unique address (factory default)
        .... ...1 .... .... .... .... = IG bit: Group address (multicast/broadcast)
    Source: IngramMicroS_4b:17:a0 (7c:c1:77:4b:17:a0)
        .... ..0. .... .... .... .... = LG bit: Globally unique address (factory default)
        .... ...0 .... .... .... .... = IG bit: Individual address (unicast)
    Type: IPv4 (0x0800)
    [Stream index: 1]
    Padding: 0000000000000000000000000000
Internet Protocol Version 4, Src: 192.168.1.1, Dst: 224.0.0.1
    0100 .... = Version: 4
    .... 0110 = Header Length: 24 bytes (6)
    Differentiated Services Field: 0x80 (DSCP: CS4, ECN: Not-ECT)
        1000 00.. = Differentiated Services Codepoint: Class Selector 4 (32)
        .... ..00 = Explicit Congestion Notification: Not ECN-Capable Transport (0)
    Total Length: 32
    Identification: 0x0000 (0)
    010. .... = Flags: 0x2, Don't fragment
        0... .... = Reserved bit: Not set
        .1.. .... = Don't fragment: Set
        ..0. .... = More fragments: Not set
    ...0 0000 0000 0000 = Fragment Offset: 0
    Time to Live: 1
    Protocol: IGMP (2)
    Header Checksum: 0x42ad [validation disabled]
    [Header checksum status: Unverified]
    Source Address: 192.168.1.1
    Destination Address: 224.0.0.1
    Options: (4 bytes), Router Alert
        IP Option - Router Alert (4 bytes): Router shall examine packet (0)
            Type: 148
                1... .... = Copy on fragmentation: Yes
                .00. .... = Class: Control (0)
                ...1 0100 = Number: Router Alert (20)
            Length: 4
            Router Alert: Router shall examine packet (0)
    [Stream index: 0]
Internet Group Management Protocol
    [IGMP Version: 2]
    Type: Membership Query (0x11)
    Max Resp Time: 10,0 sec (0x64)
    Checksum: 0xee9b [correct]
    [Checksum Status: Good]
    Multicast Address: 0.0.0.0

0000  01 00 5e 00 00 01 7c c1 77 4b 17 a0 08 00 46 80   ..^...|.wK....F.
0010  00 20 00 00 40 00 01 02 42 ad c0 a8 01 01 e0 00   . ..@...B.......
0020  00 01 94 04 00 00 11 64 ee 9b 00 00 00 00 00 00   .......d........
0030  00 00 00 00 00 00 00 00 00 00 00 00               ............

No.     Time           Source                Destination           Protocol Length Info
      4 0.000000       192.168.1.10          224.0.0.251           IGMPv2   46     Membership Report group 224.0.0.251

Frame 4: 46 bytes on wire (368 bits), 46 bytes captured (368 bits)
    Encapsulation type: Ethernet (1)
    Arrival Time: Aug 14, 2023 11:43:03.000000000 Paris, Madrid (heure d’été)
    UTC Arrival Time: Aug 14, 2023 09:43:03.000000000 UTC
    Epoch Arrival Time: 1692006183.000000000
    [Time shift for this packet: 0.000000000 seconds]
    [Time delta from previous captured frame: 0.000000000 seconds]
    [Time delta from previous displayed frame: 0.000000000 seconds]
    [Time since reference or first frame: 0.000000000 seconds]
    Frame Number: 4
    Frame Length: 46 bytes (368 bits)
    Capture Length: 46 bytes (368 bits)
    [Frame is marked: False]
    [Frame is ignored: False]
    [Protocols in frame: eth:ethertype:ip:igmp:igmp]
    [Coloring Rule Name: Routing]
    [Coloring Rule String: hsrp || eigrp || ospf || bgp || cdp || vrrp || carp || gvrp || igmp || ismp]
Ethernet II, Src: Intel_e9:06:7e (08:d2:3e:e9:06:7e), Dst: IPv4mcast_fb (01:00:5e:00:00:fb)
    Destination: IPv4mcast_fb (01:00:5e:00:00:fb)
        .... ..0. .... .... .... .... = LG bit: Globally unique address (factory default)
        .... ...1 .... .... .... .... = IG bit: Group address (multicast/broadcast)
    Source: Intel_e9:06:7e (08:d2:3e:e9:06:7e)
        .... ..0. .... .... .... .... = LG bit: Globally unique address (factory default)
        .... ...0 .... .... .... .... = IG bit: Individual address (unicast)
    Type: IPv4 (0x0800)
    [Stream index: 2]
Internet Protocol Version 4, Src: 192.168.1.10, Dst: 224.0.0.251
    0100 .... = Version: 4
    .... 0110 = Header Length: 24 bytes (6)
    Differentiated Services Field: 0x00 (DSCP: CS0, ECN: Not-ECT)
        0000 00.. = Differentiated Services Codepoint: Default (0)
        .... ..00 = Explicit Congestion Notification: Not ECN-Capable Transport (0)
    Total Length: 32
    Identification: 0x6c5a (27738)
    000. .... = Flags: 0x0
        0... .... = Reserved bit: Not set
        .0.. .... = Don't fragment: Not set
        ..0. .... = More fragments: Not set
    ...0 0000 0000 0000 = Fragment Offset: 0
    Time to Live: 1
    Protocol: IGMP (2)
    Header Checksum: 0x0000 [validation disabled]
    [Header checksum status: Unverified]
    Source Address: 192.168.1.10
    Destination Address: 224.0.0.251
    Options: (4 bytes), Router Alert
        IP Option - Router Alert (4 bytes): Router shall examine packet (0)
            Type: 148
                1... .... = Copy on fragmentation: Yes
                .00. .... = Class: Control (0)
                ...1 0100 = Number: Router Alert (20)
            Length: 4
            Router Alert: Router shall examine packet (0)
    [Stream index: 1]
Internet Group Management Protocol
    [IGMP Version: 2]
    Type: Membership Report (0x16)
    Max Resp Time: 0,0 sec (0x00)
    Checksum: 0x0904 [correct]
    [Checksum Status: Good]
    Multicast Address: 224.0.0.251

0000  01 00 5e 00 00 fb 08 d2 3e e9 06 7e 08 00 46 00   ..^.....>..~..F.
0010  00 20 6c 5a 00 00 01 02 00 00 c0 a8 01 0a e0 00   . lZ............
0020  00 fb 94 04 00 00 16 00 09 04 e0 00 00 fb         ..............

No.     Time           Source                Destination           Protocol Length Info
      5 1.000000       192.168.1.10          239.255.255.250       IGMPv2   46     Membership Report group 239.255.255.250

Frame 5: 46 bytes on wire (368 bits), 46 bytes captured (368 bits)
    Encapsulation type: Ethernet (1)
    Arrival Time: Aug 14, 2023 11:43:04.000000000 Paris, Madrid (heure d’été)
    UTC Arrival Time: Aug 14, 2023 09:43:04.000000000 UTC
    Epoch Arrival Time: 1692006184.000000000
    [Time shift for this packet: 0.000000000 seconds]
    [Time delta from previous captured frame: 1.000000000 seconds]
    [Time delta from previous displayed frame: 1.000000000 seconds]
    [Time since reference or first frame: 1.000000000 seconds]
    Frame Number: 5
    Frame Length: 46 bytes (368 bits)
    Capture Length: 46 bytes (368 bits)
    [Frame is marked: False]
    [Frame is ignored: False]
    [Protocols in frame: eth:ethertype:ip:igmp:igmp]
    [Coloring Rule Name: Routing]
    [Coloring Rule String: hsrp || eigrp || ospf || bgp || cdp || vrrp || carp || gvrp || igmp || ismp]
Ethernet II, Src: Intel_e9:06:7e (08:d2:3e:e9:06:7e), Dst: IPv4mcast_7f:ff:fa (01:00:5e:7f:ff:fa)
    Destination: IPv4mcast_7f:ff:fa (01:00:5e:7f:ff:fa)
        .... ..0. .... .... .... .... = LG bit: Globally unique address (factory default)
        .... ...1 .... .... .... .... = IG bit: Group address (multicast/broadcast)
    Source: Intel_e9:06:7e (08:d2:3e:e9:06:7e)
        .... ..0. .... .... .... .... = LG bit: Globally unique address (factory default)
        .... ...0 .... .... .... .... = IG bit: Individual address (unicast)
    Type: IPv4 (0x0800)
    [Stream index: 3]
Internet Protocol Version 4, Src: 192.168.1.10, Dst: 239.255.255.250
    0100 .... = Version: 4
    .... 0110 = Header Length: 24 bytes (6)
    Differentiated Services Field: 0x00 (DSCP: CS0, ECN: Not-ECT)
        0000 00.. = Differentiated Services Codepoint: Default (0)
        .... ..00 = Explicit Congestion Notification: Not ECN-Capable Transport (0)
    Total Length: 32
    Identification: 0x2068 (8296)
    000. .... = Flags: 0x0
        0... .... = Reserved bit: Not set
        .0.. .... = Don't fragment: Not set
        ..0. .... = More fragments: Not set
    ...0 0000 0000 0000 = Fragment Offset: 0
    Time to Live: 1
    Protocol: IGMP (2)
    Header Checksum: 0x0000 [validation disabled]
    [Header checksum status: Unverified]
    Source Address: 192.168.1.10
    Destination Address: 239.255.255.250
    Options: (4 bytes), Router Alert
        IP Option - Router Alert (4 bytes): Router shall examine packet (0)
            Type: 148
                1... .... = Copy on fragmentation: Yes
                .00. .... = Class: Control (0)
                ...1 0100 = Number: Router Alert (20)
            Length: 4
            Router Alert: Router shall examine packet (0)
    [Stream index: 2]
Internet Group Management Protocol
    [IGMP Version: 2]
    Type: Membership Report (0x16)
    Max Resp Time: 0,0 sec (0x00)
    Checksum: 0xfa04 [correct]
    [Checksum Status: Good]
    Multicast Address: 239.255.255.250

0000  01 00 5e 7f ff fa 08 d2 3e e9 06 7e 08 00 46 00   ..^.....>..~..F.
0010  00 20 20 68 00 00 01 02 00 00 c0 a8 01 0a ef ff   .  h............
0020  ff fa 94 04 00 00 16 00 fa 04 ef ff ff fa         ..............

No.     Time           Source                Destination           Protocol Length Info
      6 2.000000       192.168.1.10          224.0.0.252           IGMPv2   46     Membership Report group 224.0.0.252

Frame 6: 46 bytes on wire (368 bits), 46 bytes captured (368 bits)
    Encapsulation type: Ethernet (1)
    Arrival Time: Aug 14, 2023 11:43:05.000000000 Paris, Madrid (heure d’été)
    UTC Arrival Time: Aug 14, 2023 09:43:05.000000000 UTC
    Epoch Arrival Time: 1692006185.000000000
    [Time shift for this packet: 0.000000000 seconds]
    [Time delta from previous captured frame: 1.000000000 seconds]
    [Time delta from previous displayed frame: 1.000000000 seconds]
    [Time since reference or first frame: 2.000000000 seconds]
    Frame Number: 6
    Frame Length: 46 bytes (368 bits)
    Capture Length: 46 bytes (368 bits)
    [Frame is marked: False]
    [Frame is ignored: False]
    [Protocols in frame: eth:ethertype:ip:igmp:igmp]
    [Coloring Rule Name: Routing]
    [Coloring Rule String: hsrp || eigrp || ospf || bgp || cdp || vrrp || carp || gvrp || igmp || ismp]
Ethernet II, Src: Intel_e9:06:7e (08:d2:3e:e9:06:7e), Dst: IPv4mcast_fc (01:00:5e:00:00:fc)
    Destination: IPv4mcast_fc (01:00:5e:00:00:fc)
        .... ..0. .... .... .... .... = LG bit: Globally unique address (factory default)
        .... ...1 .... .... .... .... = IG bit: Group address (multicast/broadcast)
    Source: Intel_e9:06:7e (08:d2:3e:e9:06:7e)
        .... ..0. .... .... .... .... = LG bit: Globally unique address (factory default)
        .... ...0 .... .... .... .... = IG bit: Individual address (unicast)
    Type: IPv4 (0x0800)
    [Stream index: 4]
Internet Protocol Version 4, Src: 192.168.1.10, Dst: 224.0.0.252
    0100 .... = Version: 4
    .... 0110 = Header Length: 24 bytes (6)
    Differentiated Services Field: 0x00 (DSCP: CS0, ECN: Not-ECT)
        0000 00.. = Differentiated Services Codepoint: Default (0)
        .... ..00 = Explicit Congestion Notification: Not ECN-Capable Transport (0)
    Total Length: 32
    Identification: 0x8fea (36842)
    000. .... = Flags: 0x0
        0... .... = Reserved bit: Not set
        .0.. .... = Don't fragment: Not set
        ..0. .... = More fragments: Not set
    ...0 0000 0000 0000 = Fragment Offset: 0
    Time to Live: 1
    Protocol: IGMP (2)
    Header Checksum: 0x0000 [validation disabled]
    [Header checksum status: Unverified]
    Source Address: 192.168.1.10
    Destination Address: 224.0.0.252
    Options: (4 bytes), Router Alert
        IP Option - Router Alert (4 bytes): Router shall examine packet (0)
            Type: 148
                1... .... = Copy on fragmentation: Yes
                .00. .... = Class: Control (0)
                ...1 0100 = Number: Router Alert (20)
            Length: 4
            Router Alert: Router shall examine packet (0)
    [Stream index: 3]
Internet Group Management Protocol
    [IGMP Version: 2]
    Type: Membership Report (0x16)
    Max Resp Time: 0,0 sec (0x00)
    Checksum: 0x0903 [correct]
    [Checksum Status: Good]
    Multicast Address: 224.0.0.252

0000  01 00 5e 00 00 fc 08 d2 3e e9 06 7e 08 00 46 00   ..^.....>..~..F.
0010  00 20 8f ea 00 00 01 02 00 00 c0 a8 01 0a e0 00   . ..............
0020  00 fc 94 04 00 00 16 00 09 03 e0 00 00 fc         ..............

No.     Time           Source                Destination           Protocol Length Info
      7 2.000000       192.168.1.10          84.17.42.168          TCP      55     46073 → 443 [ACK] Seq=1 Ack=1 Win=511 Len=1

Frame 7: 55 bytes on wire (440 bits), 55 bytes captured (440 bits)
    Encapsulation type: Ethernet (1)
    Arrival Time: Aug 14, 2023 11:43:05.000000000 Paris, Madrid (heure d’été)
    UTC Arrival Time: Aug 14, 2023 09:43:05.000000000 UTC
    Epoch Arrival Time: 1692006185.000000000
    [Time shift for this packet: 0.000000000 seconds]
    [Time delta from previous captured frame: 0.000000000 seconds]
    [Time delta from previous displayed frame: 0.000000000 seconds]
    [Time since reference or first frame: 2.000000000 seconds]
    Frame Number: 7
    Frame Length: 55 bytes (440 bits)
    Capture Length: 55 bytes (440 bits)
    [Frame is marked: False]
    [Frame is ignored: False]
    [Protocols in frame: eth:ethertype:ip:tcp]
    [Coloring Rule Name: TCP]
    [Coloring Rule String: tcp]
Ethernet II, Src: Intel_e9:06:7e (08:d2:3e:e9:06:7e), Dst: IngramMicroS_4b:17:a0 (7c:c1:77:4b:17:a0)
    Destination: IngramMicroS_4b:17:a0 (7c:c1:77:4b:17:a0)
        .... ..0. .... .... .... .... = LG bit: Globally unique address (factory default)
        .... ...0 .... .... .... .... = IG bit: Individual address (unicast)
    Source: Intel_e9:06:7e (08:d2:3e:e9:06:7e)
        .... ..0. .... .... .... .... = LG bit: Globally unique address (factory default)
        .... ...0 .... .... .... .... = IG bit: Individual address (unicast)
    Type: IPv4 (0x0800)
    [Stream index: 0]
Internet Protocol Version 4, Src: 192.168.1.10, Dst: 84.17.42.168
    0100 .... = Version: 4
    .... 0101 = Header Length: 20 bytes (5)
    Differentiated Services Field: 0x00 (DSCP: CS0, ECN: Not-ECT)
        0000 00.. = Differentiated Services Codepoint: Default (0)
        .... ..00 = Explicit Congestion Notification: Not ECN-Capable Transport (0)
    Total Length: 41
    Identification: 0x798d (31117)
    010. .... = Flags: 0x2, Don't fragment
        0... .... = Reserved bit: Not set
        .1.. .... = Don't fragment: Set
        ..0. .... = More fragments: Not set
    ...0 0000 0000 0000 = Fragment Offset: 0
    Time to Live: 128
    Protocol: TCP (6)
    Header Checksum: 0x0000 [validation disabled]
    [Header checksum status: Unverified]
    Source Address: 192.168.1.10
    Destination Address: 84.17.42.168
    [Stream index: 4]
Transmission Control Protocol, Src Port: 46073, Dst Port: 443, Seq: 1, Ack: 1, Len: 1
    Source Port: 46073
    Destination Port: 443
    [Stream index: 0]
    [Stream Packet Number: 1]
    [Conversation completeness: Incomplete (12)]
        ..0. .... = RST: Absent
        ...0 .... = FIN: Absent
        .... 1... = Data: Present
        .... .1.. = ACK: Present
        .... ..0. = SYN-ACK: Absent
        .... ...0 = SYN: Absent
        [Completeness Flags: ··DA··]
    [TCP Segment Len: 1]
    Sequence Number: 1    (relative sequence number)
    Sequence Number (raw): 2513741423
    [Next Sequence Number: 2    (relative sequence number)]
    Acknowledgment Number: 1    (relative ack number)
    Acknowledgment number (raw): 539834574
    0101 .... = Header Length: 20 bytes (5)
    Flags: 0x010 (ACK)
        000. .... .... = Reserved: Not set
        ...0 .... .... = Accurate ECN: Not set
        .... 0... .... = Congestion Window Reduced: Not set
        .... .0.. .... = ECN-Echo: Not set
        .... ..0. .... = Urgent: Not set
        .... ...1 .... = Acknowledgment: Set
        .... .... 0... = Push: Not set
        .... .... .0.. = Reset: Not set
        .... .... ..0. = Syn: Not set
        .... .... ...0 = Fin: Not set
        [TCP Flags: ·······A····]
    Window: 511
    [Calculated window size: 511]
    [Window size scaling factor: -1 (unknown)]
    Checksum: 0x4087 [unverified]
    [Checksum Status: Unverified]
    Urgent Pointer: 0
    [Timestamps]
        [Time since first frame in this TCP stream: 0.000000000 seconds]
        [Time since previous frame in this TCP stream: 0.000000000 seconds]
    [SEQ/ACK analysis]
        [Bytes in flight: 1]
        [Bytes sent since last PSH flag: 1]
    TCP payload (1 byte)
    TCP segment data (1 byte)

0000  7c c1 77 4b 17 a0 08 d2 3e e9 06 7e 08 00 45 00   |.wK....>..~..E.
0010  00 29 79 8d 40 00 80 06 00 00 c0 a8 01 0a 54 11   .)y.@.........T.
0020  2a a8 b3 f9 01 bb 95 d4 a6 6f 20 2d 38 ce 50 10   *........o -8.P.
0030  01 ff 40 87 00 00 00                              ..@....

No.     Time           Source                Destination           Protocol Length Info
      8 2.000000       84.17.42.168          192.168.1.10          TCP      66     443 → 46073 [ACK] Seq=1 Ack=2 Win=501 Len=0 SLE=1 SRE=2

Frame 8: 66 bytes on wire (528 bits), 66 bytes captured (528 bits)
    Encapsulation type: Ethernet (1)
    Arrival Time: Aug 14, 2023 11:43:05.000000000 Paris, Madrid (heure d’été)
    UTC Arrival Time: Aug 14, 2023 09:43:05.000000000 UTC
    Epoch Arrival Time: 1692006185.000000000
    [Time shift for this packet: 0.000000000 seconds]
    [Time delta from previous captured frame: 0.000000000 seconds]
    [Time delta from previous displayed frame: 0.000000000 seconds]
    [Time since reference or first frame: 2.000000000 seconds]
    Frame Number: 8
    Frame Length: 66 bytes (528 bits)
    Capture Length: 66 bytes (528 bits)
    [Frame is marked: False]
    [Frame is ignored: False]
    [Protocols in frame: eth:ethertype:ip:tcp]
    [Coloring Rule Name: TCP]
    [Coloring Rule String: tcp]
Ethernet II, Src: IngramMicroS_4b:17:a0 (7c:c1:77:4b:17:a0), Dst: Intel_e9:06:7e (08:d2:3e:e9:06:7e)
    Destination: Intel_e9:06:7e (08:d2:3e:e9:06:7e)
        .... ..0. .... .... .... .... = LG bit: Globally unique address (factory default)
        .... ...0 .... .... .... .... = IG bit: Individual address (unicast)
    Source: IngramMicroS_4b:17:a0 (7c:c1:77:4b:17:a0)
        .... ..0. .... .... .... .... = LG bit: Globally unique address (factory default)
        .... ...0 .... .... .... .... = IG bit: Individual address (unicast)
    Type: IPv4 (0x0800)
    [Stream index: 0]
Internet Protocol Version 4, Src: 84.17.42.168, Dst: 192.168.1.10
    0100 .... = Version: 4
    .... 0101 = Header Length: 20 bytes (5)
    Differentiated Services Field: 0x00 (DSCP: CS0, ECN: Not-ECT)
        0000 00.. = Differentiated Services Codepoint: Default (0)
        .... ..00 = Explicit Congestion Notification: Not ECN-Capable Transport (0)
    Total Length: 52
    Identification: 0x0c9a (3226)
    010. .... = Flags: 0x2, Don't fragment
        0... .... = Reserved bit: Not set
        .1.. .... = Don't fragment: Set
        ..0. .... = More fragments: Not set
    ...0 0000 0000 0000 = Fragment Offset: 0
    Time to Live: 249
    Protocol: TCP (6)
    Header Checksum: 0x34be [validation disabled]
    [Header checksum status: Unverified]
    Source Address: 84.17.42.168
    Destination Address: 192.168.1.10
    [Stream index: 4]
Transmission Control Protocol, Src Port: 443, Dst Port: 46073, Seq: 1, Ack: 2, Len: 0
    Source Port: 443
    Destination Port: 46073
    [Stream index: 0]
    [Stream Packet Number: 2]
    [Conversation completeness: Incomplete (12)]
        ..0. .... = RST: Absent
        ...0 .... = FIN: Absent
        .... 1... = Data: Present
        .... .1.. = ACK: Present
        .... ..0. = SYN-ACK: Absent
        .... ...0 = SYN: Absent
        [Completeness Flags: ··DA··]
    [TCP Segment Len: 0]
    Sequence Number: 1    (relative sequence number)
    Sequence Number (raw): 539834574
    [Next Sequence Number: 1    (relative sequence number)]
    Acknowledgment Number: 2    (relative ack number)
    Acknowledgment number (raw): 2513741424
    1000 .... = Header Length: 32 bytes (8)
    Flags: 0x010 (ACK)
        000. .... .... = Reserved: Not set
        ...0 .... .... = Accurate ECN: Not set
        .... 0... .... = Congestion Window Reduced: Not set
        .... .0.. .... = ECN-Echo: Not set
        .... ..0. .... = Urgent: Not set
        .... ...1 .... = Acknowledgment: Set
        .... .... 0... = Push: Not set
        .... .... .0.. = Reset: Not set
        .... .... ..0. = Syn: Not set
        .... .... ...0 = Fin: Not set
        [TCP Flags: ·······A····]
    Window: 501
    [Calculated window size: 501]
    [Window size scaling factor: -1 (unknown)]
    Checksum: 0x73de [unverified]
    [Checksum Status: Unverified]
    Urgent Pointer: 0
    Options: (12 bytes), No-Operation (NOP), No-Operation (NOP), SACK
        TCP Option - No-Operation (NOP)
            Kind: No-Operation (1)
        TCP Option - No-Operation (NOP)
            Kind: No-Operation (1)
        TCP Option - SACK 1-2
            Kind: SACK (5)
            Length: 10
            left edge = 1 (relative)
            right edge = 2 (relative)
            [TCP SACK Count: 1]
            [D-SACK Left Edge = 1 (relative)]
            [D-SACK Right Edge = 2 (relative)]
            D-SACK Sequence
                [Expert Info (Warning/Sequence): D-SACK Sequence]
                    [D-SACK Sequence]
                    [Severity level: Warning]
                    [Group: Sequence]
    [Timestamps]
        [Time since first frame in this TCP stream: 0.000000000 seconds]
        [Time since previous frame in this TCP stream: 0.000000000 seconds]
    [SEQ/ACK analysis]
        [This is an ACK to the segment in frame: 7]

0000  08 d2 3e e9 06 7e 7c c1 77 4b 17 a0 08 00 45 00   ..>..~|.wK....E.
0010  00 34 0c 9a 40 00 f9 06 34 be 54 11 2a a8 c0 a8   .4..@...4.T.*...
0020  01 0a 01 bb b3 f9 20 2d 38 ce 95 d4 a6 70 80 10   ...... -8....p..
0030  01 f5 73 de 00 00 01 01 05 0a 95 d4 a6 6f 95 d4   ..s..........o..
0040  a6 70                                             .p

No.     Time           Source                Destination           Protocol Length Info
      9 3.000000       192.168.1.21          239.255.255.250       SSDP     369    NOTIFY * HTTP/1.1 

Frame 9: 369 bytes on wire (2952 bits), 369 bytes captured (2952 bits)
    Encapsulation type: Ethernet (1)
    Arrival Time: Aug 14, 2023 11:43:06.000000000 Paris, Madrid (heure d’été)
    UTC Arrival Time: Aug 14, 2023 09:43:06.000000000 UTC
    Epoch Arrival Time: 1692006186.000000000
    [Time shift for this packet: 0.000000000 seconds]
    [Time delta from previous captured frame: 1.000000000 seconds]
    [Time delta from previous displayed frame: 1.000000000 seconds]
    [Time since reference or first frame: 3.000000000 seconds]
    Frame Number: 9
    Frame Length: 369 bytes (2952 bits)
    Capture Length: 369 bytes (2952 bits)
    [Frame is marked: False]
    [Frame is ignored: False]
    [Protocols in frame: eth:ethertype:ip:udp:ssdp]
    [Coloring Rule Name: UDP]
    [Coloring Rule String: udp]
Ethernet II, Src: WesternDigit_da:4f:b5 (00:90:a9:da:4f:b5), Dst: Intel_e9:06:7e (08:d2:3e:e9:06:7e)
    Destination: Intel_e9:06:7e (08:d2:3e:e9:06:7e)
        .... ..0. .... .... .... .... = LG bit: Globally unique address (factory default)
        .... ...0 .... .... .... .... = IG bit: Individual address (unicast)
    Source: WesternDigit_da:4f:b5 (00:90:a9:da:4f:b5)
        .... ..0. .... .... .... .... = LG bit: Globally unique address (factory default)
        .... ...0 .... .... .... .... = IG bit: Individual address (unicast)
    Type: IPv4 (0x0800)
    [Stream index: 5]
Internet Protocol Version 4, Src: 192.168.1.21, Dst: 239.255.255.250
    0100 .... = Version: 4
    .... 0101 = Header Length: 20 bytes (5)
    Differentiated Services Field: 0x00 (DSCP: CS0, ECN: Not-ECT)
        0000 00.. = Differentiated Services Codepoint: Default (0)
        .... ..00 = Explicit Congestion Notification: Not ECN-Capable Transport (0)
    Total Length: 355
    Identification: 0xd8c3 (55491)
    000. .... = Flags: 0x0
        0... .... = Reserved bit: Not set
        .0.. .... = Don't fragment: Not set
        ..0. .... = More fragments: Not set
    ...0 0000 0000 0000 = Fragment Offset: 0
    Time to Live: 4
    Protocol: UDP (17)
    Header Checksum: 0x2b0f [validation disabled]
    [Header checksum status: Unverified]
    Source Address: 192.168.1.21
    Destination Address: 239.255.255.250
    [Stream index: 5]
User Datagram Protocol, Src Port: 1900, Dst Port: 1900
    Source Port: 1900
    Destination Port: 1900
    Length: 335
    Checksum: 0x6300 [unverified]
    [Checksum Status: Unverified]
    [Stream index: 0]
    [Stream Packet Number: 1]
    [Timestamps]
        [Time since first frame: 0.000000000 seconds]
        [Time since previous frame: 0.000000000 seconds]
    UDP payload (327 bytes)
Simple Service Discovery Protocol
    NOTIFY * HTTP/1.1\r\n
        Request Method: NOTIFY
        Request URI: *
        Request Version: HTTP/1.1
    HOST: 239.255.255.250:1900\r\n
    CACHE-CONTROL: max-age=1810\r\n
    LOCATION: http://192.168.1.21:9000/TMSDeviceDescription.xml\r\n
    NT: uuid:55076f6e-6b79-4d65-6436-0090a9da4fb5\r\n
    NTS: ssdp:alive\r\n
    SERVER: Linux/2.x.x, UPnP/1.0, pvConnect UPnP SDK/1.0, Twonky UPnP SDK/1.1\r\n
    USN: uuid:55076f6e-6b79-4d65-6436-0090a9da4fb5\r\n
    \r\n

0000  08 d2 3e e9 06 7e 00 90 a9 da 4f b5 08 00 45 00   ..>..~....O...E.
0010  01 63 d8 c3 00 00 04 11 2b 0f c0 a8 01 15 ef ff   .c......+.......
0020  ff fa 07 6c 07 6c 01 4f 63 00 4e 4f 54 49 46 59   ...l.l.Oc.NOTIFY
0030  20 2a 20 48 54 54 50 2f 31 2e 31 0d 0a 48 4f 53    * HTTP/1.1..HOS
0040  54 3a 20 32 33 39 2e 32 35 35 2e 32 35 35 2e 32   T: 239.255.255.2
0050  35 30 3a 31 39 30 30 0d 0a 43 41 43 48 45 2d 43   50:1900..CACHE-C
0060  4f 4e 54 52 4f 4c 3a 20 6d 61 78 2d 61 67 65 3d   ONTROL: max-age=
0070  31 38 31 30 0d 0a 4c 4f 43 41 54 49 4f 4e 3a 20   1810..LOCATION: 
0080  68 74 74 70 3a 2f 2f 31 39 32 2e 31 36 38 2e 31   http://192.168.1
0090  2e 32 31 3a 39 30 30 30 2f 54 4d 53 44 65 76 69   .21:9000/TMSDevi
00a0  63 65 44 65 73 63 72 69 70 74 69 6f 6e 2e 78 6d   ceDescription.xm
00b0  6c 0d 0a 4e 54 3a 20 75 75 69 64 3a 35 35 30 37   l..NT: uuid:5507
00c0  36 66 36 65 2d 36 62 37 39 2d 34 64 36 35 2d 36   6f6e-6b79-4d65-6
00d0  34 33 36 2d 30 30 39 30 61 39 64 61 34 66 62 35   436-0090a9da4fb5
00e0  0d 0a 4e 54 53 3a 20 73 73 64 70 3a 61 6c 69 76   ..NTS: ssdp:aliv
00f0  65 0d 0a 53 45 52 56 45 52 3a 20 4c 69 6e 75 78   e..SERVER: Linux
0100  2f 32 2e 78 2e 78 2c 20 55 50 6e 50 2f 31 2e 30   /2.x.x, UPnP/1.0
0110  2c 20 70 76 43 6f 6e 6e 65 63 74 20 55 50 6e 50   , pvConnect UPnP
0120  20 53 44 4b 2f 31 2e 30 2c 20 54 77 6f 6e 6b 79    SDK/1.0, Twonky
0130  20 55 50 6e 50 20 53 44 4b 2f 31 2e 31 0d 0a 55    UPnP SDK/1.1..U
0140  53 4e 3a 20 75 75 69 64 3a 35 35 30 37 36 66 36   SN: uuid:55076f6
0150  65 2d 36 62 37 39 2d 34 64 36 35 2d 36 34 33 36   e-6b79-4d65-6436
0160  2d 30 30 39 30 61 39 64 61 34 66 62 35 0d 0a 0d   -0090a9da4fb5...
0170  0a                                                .

No.     Time           Source                Destination           Protocol Length Info
     10 3.000000       192.168.1.21          239.255.255.250       SSDP     360    NOTIFY * HTTP/1.1 

Frame 10: 360 bytes on wire (2880 bits), 360 bytes captured (2880 bits)
    Encapsulation type: Ethernet (1)
    Arrival Time: Aug 14, 2023 11:43:06.000000000 Paris, Madrid (heure d’été)
    UTC Arrival Time: Aug 14, 2023 09:43:06.000000000 UTC
    Epoch Arrival Time: 1692006186.000000000
    [Time shift for this packet: 0.000000000 seconds]
    [Time delta from previous captured frame: 0.000000000 seconds]
    [Time delta from previous displayed frame: 0.000000000 seconds]
    [Time since reference or first frame: 3.000000000 seconds]
    Frame Number: 10
    Frame Length: 360 bytes (2880 bits)
    Capture Length: 360 bytes (2880 bits)
    [Frame is marked: False]
    [Frame is ignored: False]
    [Protocols in frame: eth:ethertype:ip:udp:ssdp]
    [Coloring Rule Name: UDP]
    [Coloring Rule String: udp]
Ethernet II, Src: WesternDigit_da:4f:b5 (00:90:a9:da:4f:b5), Dst: Intel_e9:06:7e (08:d2:3e:e9:06:7e)
    Destination: Intel_e9:06:7e (08:d2:3e:e9:06:7e)
        .... ..0. .... .... .... .... = LG bit: Globally unique address (factory default)
        .... ...0 .... .... .... .... = IG bit: Individual address (unicast)
    Source: WesternDigit_da:4f:b5 (00:90:a9:da:4f:b5)
        .... ..0. .... .... .... .... = LG bit: Globally unique address (factory default)
        .... ...0 .... .... .... .... = IG bit: Individual address (unicast)
    Type: IPv4 (0x0800)
    [Stream index: 5]
Internet Protocol Version 4, Src: 192.168.1.21, Dst: 239.255.255.250
    0100 .... = Version: 4
    .... 0101 = Header Length: 20 bytes (5)
    Differentiated Services Field: 0x00 (DSCP: CS0, ECN: Not-ECT)
        0000 00.. = Differentiated Services Codepoint: Default (0)
        .... ..00 = Explicit Congestion Notification: Not ECN-Capable Transport (0)
    Total Length: 346
    Identification: 0xd8c4 (55492)
    000. .... = Flags: 0x0
        0... .... = Reserved bit: Not set
        .0.. .... = Don't fragment: Not set
        ..0. .... = More fragments: Not set
    ...0 0000 0000 0000 = Fragment Offset: 0
    Time to Live: 4
    Protocol: UDP (17)
    Header Checksum: 0x2b17 [validation disabled]
    [Header checksum status: Unverified]
    Source Address: 192.168.1.21
    Destination Address: 239.255.255.250
    [Stream index: 5]
User Datagram Protocol, Src Port: 1900, Dst Port: 1900
    Source Port: 1900
    Destination Port: 1900
    Length: 326
    Checksum: 0x5d24 [unverified]
    [Checksum Status: Unverified]
    [Stream index: 0]
    [Stream Packet Number: 2]
    [Timestamps]
        [Time since first frame: 0.000000000 seconds]
        [Time since previous frame: 0.000000000 seconds]
    UDP payload (318 bytes)
Simple Service Discovery Protocol
    NOTIFY * HTTP/1.1\r\n
        Request Method: NOTIFY
        Request URI: *
        Request Version: HTTP/1.1
    HOST: 239.255.255.250:1900\r\n
    CACHE-CONTROL: max-age=1810\r\n
    LOCATION: http://192.168.1.21:9000/TMSDeviceDescription.xml\r\n
    NT: upnp:rootdevice\r\n
    NTS: ssdp:alive\r\n
    SERVER: Linux/2.x.x, UPnP/1.0, pvConnect UPnP SDK/1.0, Twonky UPnP SDK/1.1\r\n
    USN: uuid:55076f6e-6b79-4d65-6436-0090a9da4fb5::upnp:rootdevice\r\n
    \r\n

0000  08 d2 3e e9 06 7e 00 90 a9 da 4f b5 08 00 45 00   ..>..~....O...E.
0010  01 5a d8 c4 00 00 04 11 2b 17 c0 a8 01 15 ef ff   .Z......+.......
0020  ff fa 07 6c 07 6c 01 46 5d 24 4e 4f 54 49 46 59   ...l.l.F]$NOTIFY
0030  20 2a 20 48 54 54 50 2f 31 2e 31 0d 0a 48 4f 53    * HTTP/1.1..HOS
0040  54 3a 20 32 33 39 2e 32 35 35 2e 32 35 35 2e 32   T: 239.255.255.2
0050  35 30 3a 31 39 30 30 0d 0a 43 41 43 48 45 2d 43   50:1900..CACHE-C
0060  4f 4e 54 52 4f 4c 3a 20 6d 61 78 2d 61 67 65 3d   ONTROL: max-age=
0070  31 38 31 30 0d 0a 4c 4f 43 41 54 49 4f 4e 3a 20   1810..LOCATION: 
0080  68 74 74 70 3a 2f 2f 31 39 32 2e 31 36 38 2e 31   http://192.168.1
